OU_NAME;GLOS_PIPER;LENGTH_SCALE;KWESTIA
DIA_STEXT_ROSE_HERO_MEET_00;mc_speech;1.0;Modlisz sie w nocy. Sama. To odwaga, albo rozpacz.
DIA_STEXT_ROSE_ADELA_MEET_01;gosia;1.05;A ty podgladasz w nocy. Obcych. To ciekawosc, albo zle zamiary.
DIA_STEXT_ROSE_HERO_MEET_02;mc_speech;1.0;Zwa mnie roznie. Bezimienny wystarczy.
DIA_STEXT_ROSE_ADELA_MEET_03;gosia;1.1;Adela. Corka lorda Aldwina. Modle sie o cud. Ale cuda omijaja Khorinis.
DIA_STEXT_ROSE_HERO_MEET_04;mc_speech;1.0;Jaki cud?
DIA_STEXT_ROSE_ADELA_MEET_05;gosia;1.1;Za miesiac wychodze za czlowieka, ktorego nienawidze. Sir Roderyk. Umowa ojca. Dlugi. Honor. Wybierz sobie slowo.
DIA_STEXT_ROSE_ADELA_MEET_06;gosia;1.0;Idz juz. Jesli Roderyk sie dowie, ze rozmawiam z obcym... on nie wybacza nawet cieniom.
